id,name,search_keys.0,type,description,address,website,photos.0,category,marker.lat,marker.lng,marker.icon,gmaps.min_zoom,gmaps.max_zoom
university_of_tulsa,The University of Tulsa,,marker,The university!,"800 South Tucker Drive, Tulsa, Oklahoma 74104-9700",https://utulsa.edu,,TU MAIN CAMPUS,36.1508425996,-95.9448471164,mainCampus,,15
7th_street_house,7th Street House,,marker,"The International Living Community (ILC) is located in LaFortune and 7th Street Houses near the engineering complex, the Lorton Performance Center, H.A. Chapman Stadium and the Reynolds Center. The ILC offers many attractive conveniences including a small refrigerator in each room. The facility has a private female floor with a lounge for laundry, study and recreation. Weekly dinners offer a variety of cultures and/or guest speakers, and there are monthly excursions featuring the intercultural experiences that Tulsa and the surrounding area have to offer.","3211 East 7th Street, Tulsa, Oklahoma 74104-9700",,http://images-cf.localist.com/assets/main/business_huge-c0846f6f497bda77b914557561c412e0.png,STUDENT HOUSING,36.151096,-95.942131,housing,19,
alexander_health_center,Alexander Health Center,,marker,The Alexander Health Center provides care and treatment of illnesses and minor emergencies for all full- and part-time students as well as TU employees. The goal of the health center is to provide individualized health care with professional expertise at a minimal cost. The health center also offers patients assistance in choosing and maintaining healthy lifestyles.,"2946 East 5th Street, Tulsa, Oklahoma 74104-9700",,http://images-cf.localist.com/assets/main/business_huge-c0846f6f497bda77b914557561c412e0.png,TU MAIN CAMPUS,36.1534535085,-95.9462423092,mainCampus,19,
alexandre_hogue_gallery,Alexandre Hogue Gallery,,marker,"The Alexandre Hogue Gallery, housed in Phillips Hall and run by the School of Art, serves as the chief focal point for the university's engagement with the visual arts. Used year-round for the exhibition of arts, crafts, performance art and special events, the gallery also offers exhibits of historical, global and multicultural significance. It is also the site of the annual Gussman Student Art Exhibition and numerous shows by prominent artists and can be comfortably used for poetry readings and chamber music performances. The Hogue Gallery serves as a public venue for visiting artists and a campus showplace for School of Art faculty, students and alumni, and a forum for discussion of traditional and emerging artistic practices, innovative ideas and provocative notions.","2930 East 5th Street, Tulsa, Oklahoma 74104-9700",,http://images-cf.localist.com/assets/main/business_huge-c0846f6f497bda77b914557561c412e0.png,TU MAIN CAMPUS,36.1530401378,-95.946322038,mainCampus,19,
baptist_collegiate_ministries,Baptist Collegiate Ministries,,marker,The university is supported by a number of campus ministries that maintain facilities and outreach programs to nurture their respective constituencies. Each ministry adds its distinctive identity and voice to the interfaith conversation that articulates the religious life of the university.,"710 South College Avenue, Tulsa, Oklahoma 74104-9700",,http://images-cf.localist.com/assets/main/business_huge-c0846f6f497bda77b914557561c412e0.png,CAMPUS MINISTRIES,36.150469829,-95.9464163178,religious,19,
bayless_plaza,Bayless Plaza,,marker,"Dedicated in September 2006, the 7,500-square-foot Bayless Plaza provides a permanent home for TU's historic Kendall Bell, which has been rung by students completing their last final exam for nearly 75 years. In addition to the centerpiece bell cupola encircled by cast-stone columns, the plaza features brick walkways, gardens and benches. The plaza is named in honor of Bernice Bayless (BS '49) and her late husband, Robert Bayless (BA '49), whose generous gift funded this TU icon.","800 South Tucker Drive, Tulsa, Oklahoma 74104-9700",,http://images-cf.localist.com/photos/250620/huge/751bdb0232265904ca741d6a277b049b4f6e2cd2.jpg,TU MAIN CAMPUS,36.1512625418,-95.9467662245,photoOp,18,
bird_shell_nest,Bird Shell Nest,,marker,"The J. Bird Sr. Shell Nest is a 5,000 square foot facility for the rowing team, the first boat storage facility specifically dedicated to the needs of the varsity rowers at TU.\n \nThe location is a short 15 minute drive from campus and it allows TU access to one of the best waterways for rowing in the United States on the Verdigris River.  The Verdigris River is part of the Mississippi River watershed and sports a natural setting of 18 miles distance for the TU Women's Rowing Team to practice.  The J. Bird Sr. Shell Nest was completed in January 2007.","Rogers Point Park, 4001 North Hwy 66, Catoosa, OK 74115",,http://images-cf.localist.com/photos/361257/huge/e657ca6d779a2d32be74a112394737ae30dba607.jpg,ATHLETIC FACILITIES,36.211436,-95.721602,athletics,14,
boesche_legal_clinic,Boesche Legal Clinic,,marker,"The Clinical Education Program at The University of Tulsa College of Law prepares students for the practice of law through a combination of real-world experience, intensive supervision and dynamic seminars. Clinic students also provide essential legal services to underserved individuals and communities. By engaging in public interest legal practice, clinic students have the opportunity to critically reflect on the justice system and their role in it, in the context of their development as lawyers.","407 South Florence Avenue, Tulsa, Oklahoma 74104-9700",,http://images-cf.localist.com/photos/329698/huge/496c534fb4b738da02d2a9a0f9bbab9eb5346318.jpg,TU MAIN CAMPUS,36.1548235502,-95.9444591399,housing,17,
brown_village_apartments,Brown Village Apartments,,marker,"Comfortably located on the northeast corner of campus across from the engineering complex, these apartments are conveniently located near Allen Chapman Student Union, which houses mail services and an expansive food court. Brown Village includes 84 two-bedroom apartments and 12 one-bedroom apartments with a courtyard and housing staff that plan cookouts and other social, educational and personal development activities.","East 4th Place, Tulsa, Oklahoma 74104-9700",,http://images-cf.localist.com/assets/main/business_huge-c0846f6f497bda77b914557561c412e0.png,STUDENT HOUSING,36.1541761541,-95.941285589,housing,17,
case_athletic_complex,Case Athletic Complex,,marker,"The 29,000-square-foot, three-story Case Athletic Complex serves as home for Golden Hurricane football. The building also provides an academic achievement center with counselor's offices, private and group study areas and a computer lab serving more than 300 TU student-athletes from 18 intercollegiate teams. The football facilities include a locker room with more than 100 lockers and 18 showers, an athletic training room, hydrotherapy room, equipment storage, coaches' offices, team meeting rooms, video production facilities and Letterman's Lounge. Presentations of TU football's proud heritage are displayed throughout the building.","3150 East 8th Street, Tulsa, Oklahoma 74104-9700",,http://images-cf.localist.com/assets/main/business_huge-c0846f6f497bda77b914557561c412e0.png,ATHLETIC FACILITIES,36.14951401,-95.9437763178,athletics,18,
case_tennis_center,Case Tennis Center,,marker,"The Michael D. Case Tennis Center, named a premiere college tennis facility by the U.S. Tennis Association, includes a 54,000-square-foot tennis pavilion with spectator seating, conditioning and training facilities, lounges, essential support facilities including bath and locker rooms, lighted outdoor courts and indoor courts and electronic scoreboards. The center, which officially opened in 2001 with an inaugural dedication game played by John McEnroe, will be the host site of the 2016 NCAA Men's and Women's Division I Tennis Championships The campus venue is named for Mike Case, a local developer and philanthropist. The 2016 tournament will be the third NCAA Division I Tennis Championship hosted at the Case Tennis Center.","712 South Delaware Avenue, Tulsa, Oklahoma 74104-9700",,http://images-cf.localist.com/assets/main/business_huge-c0846f6f497bda77b914557561c412e0.png,ATHLETIC FACILITIES,36.1502625026,-95.9498599325,athletics,18,
chapman_commons,Chapman Commons (“The U”),The U,marker,"TU's south entrance, facing 11th Street along historic Route 66, provides a dramatic welcome to TU's residential campus. Components of the entrance project include the 5-acre Chapman Commons, the Genave King Rogers Fountain and Tucker Drive, Chapman Commons provides a picturesque campus entrance and facilitates outdoor gatherings both small and large. On football game days, Chapman Commons is the primary site for TU tailgate parties.","800 South Tucker Drive, Tulsa, Oklahoma 74104-9700",,http://images-cf.localist.com/photos/329707/huge/6960a413782690ed806757759404c509f3b9c66f.jpg,TU MAIN CAMPUS,36.1489504852,-95.9467355804,bike,16,
chapman_hall,Chapman Hall,,marker,"Chapman Hall, originally built in 1971 to house the College of Nursing, was the most modern nursing training center in the nation at the time. Currently, Chapman Hall is the home of the Henry Kendall College of Arts and Sciences.","2830 East 5th Street, Tulsa, Oklahoma 74104-9700",,http://images-cf.localist.com/assets/main/business_huge-c0846f6f497bda77b914557561c412e0.png,TU MAIN CAMPUS,36.1530590056,-95.9479187546,mainCampus,17,
chapman_theatre_201,Chapman Theatre,,marker,"Chapman Theatre, a proscenium thrust stage that seats 375, is equipped with a computerized lighting board and sound system. Theatre II is an experimental stage space that can accommodate any audience spatial relationship (round, thrust, proscenium, environmental.)","601 South College Avenue, Tulsa, Oklahoma 74104-9700",,http://images-cf.localist.com/assets/main/business_huge-c0846f6f497bda77b914557561c412e0.png,TU MAIN CAMPUS,36.1517964151,-95.9455484673,mainCampus,18,
college_of_law,College of Law,,marker,"This building houses the College of Law. Renovations were made in 2011 that improved the access, functionality and look of the building.","3120 East 4th Place, Tulsa, Oklahoma 74104-9700",,http://images-cf.localist.com/assets/main/business_huge-c0846f6f497bda77b914557561c412e0.png,TU MAIN CAMPUS,36.1543508518,-95.9437581055,mainCampus,17,
collins_family_softball_complex,Collins Family Softball Complex,,marker,"The Collins Family Softball Complex, which opened in 2002, features a burmed sitting area with a facade of Tennessee ledgestone. The field includes a shrub-lined outfield fence, as well as an outfield warning track, bullpens and batting cages along with a press box and scoreboard. Sunken dugouts are located just below the seating, which includes a capacity of approximately 800. The new building, completed in January 2012, provides the Golden Hurricane a locker room and team room, as well as coaches' game day office and umpire locker rooms. The softball field and locker room facility complex, named in honor of the late Fulton Collins, former Board of Trustees chairman, and his wife, Susie, is part of the larger Donna J. Hardesty Sports Complex.","South Delaware Avenue, Tulsa, Oklahoma 74104-9700",,http://images-cf.localist.com/assets/main/business_huge-c0846f6f497bda77b914557561c412e0.png,ATHLETIC FACILITIES,36.1512478183,-95.9508441607,athletics,18,
collins_fitness_center,Collins Fitness Center,,marker,"The Fulton and Susie Collins Fitness Center offers students a modern facility that fosters health and recreation. The fitness center houses three basketball courts, a workout area with 200+ pieces of equipment and a lounge with a big-screen television, furniture and its very own snack bar. A 3,200-square-foot multipurpose room, which can be divided into two rooms, has a soundproof wall and is used for aerobics, dance, kickboxing, ballet and yoga classes. Other features include a game room and a 1/8th-mile suspended indoor track. A sound system runs throughout the building.","502 South Delaware, Tulsa, Oklahoma 74104-9700",,http://images-cf.localist.com/assets/main/business_huge-c0846f6f497bda77b914557561c412e0.png,TU MAIN CAMPUS,36.1533809718,-95.9497352037,athletics,16,
collins_hall,Collins Hall,,marker,"The focal point of TU's new south entrance, Collins Hall provides a stunning gateway into the TU campus for visitors and alumni. The two-story, 39,000-square-foot building was dedicated in August 2007. Collins Hall consolidates key student services, such as financial aid and admission, into one central location. Collins Hall houses the TU Alumni Association offices with spaces for alumni activities, as well as areas where university memorabilia are displayed. Key university administrators, including the president, have offices in the building.","2905 East 8th Street, Tulsa, Oklahoma 74104-9700",,http://images-cf.localist.com/assets/main/business_huge-c0846f6f497bda77b914557561c412e0.png,TU MAIN CAMPUS,36.150051,-95.946785,mainCampus,16,
dietler_commons_formerly_the_u,"Dietler Commons (formerly ""the U"")",The old U,marker,"The Dietler Commons is the large grassy area in front of McFarlin Library, and was the traditional entrance to the university. The open lawn with winding sidewalks and an iconic raised garden with seasonal flowers that spell out ""TU� is the site for many outdoor gatherings and the annual Homecoming bonfire and festivities.","South Delaware Avenue, Tulsa, Oklahoma 74104-9700",,http://images-cf.localist.com/assets/main/business_huge-c0846f6f497bda77b914557561c412e0.png,TU MAIN CAMPUS,36.1521427286,-95.9479755645,mainCampus,16,
fisher_hall_east_pat_case_dining_center,Fisher Hall East / Pat Case Dining Center,The caf,marker,"Completely remodeled in 2010, this facility houses the Pat Case Dining Center as well as several offices for student and employee services. The exterior features a pavilion for dining al fresco, while the interior reflects a contemporary design with dark and light woods with bright and modern finishes.","2821 East 8th Street, Tulsa, Oklahoma 74104-9700",,http://images-cf.localist.com/assets/main/business_huge-c0846f6f497bda77b914557561c412e0.png,TU MAIN CAMPUS,36.1504645026,-95.9483332761,mainCampus,17,
fisher_hall_south,Fisher Hall South,,marker,"With its contemporary open architecture, Fisher South provides a modern, but home-like environment. In addition to the many amenities it shares with other TU residence halls, it features a three-story skylight atrium and open lounge areas. A central staircase opens onto all lounge areas, encouraging a community feeling. Fisher South has a carpeted study lounge with carrels, a lounge with fireplace and a mini-kitchen, equipped for recreational cooking. The first-floor lounge, with its large-screen TV, is a popular spot for weekly movie nights and sporting events.","2831 East 8th Street, Tulsa, Oklahoma 74104-9700",,http://images-cf.localist.com/assets/main/business_huge-c0846f6f497bda77b914557561c412e0.png,STUDENT HOUSING,36.1499885127,-95.9477401399,housing,18,
fisher_hall_west_suites,Fisher Hall West Suites,,marker,"Fisher West Suites provide an exceptional on-campus living experience for upper classmen and graduate and law students. This housing is designated for students who want a community environment with more independent living. Fisher West Suites was renovated in 2010. All standard and deluxe suites have fully furnished common areas and bathrooms. Each room is equipped with wireless Internet, micro-fridge, cable outlet and moveable bed, desk and wardrobe.","2821 East 8th_Street, Tulsa, Oklahoma 74104-9700",,http://images-cf.localist.com/assets/main/business_huge-c0846f6f497bda77b914557561c412e0.png,STUDENT HOUSING,36.1504506839,-95.9489303816,housing,18,
fraternity_row,Fraternity Row,,marker,"Seven national fraternities have chapters on campus. These organizations encourage scholarship, leadership, social, and personal development.","East 7th Street, Tulsa, Oklahoma 74104-9700",,http://images-cf.localist.com/assets/main/business_huge-c0846f6f497bda77b914557561c412e0.png,STUDENT HOUSING,36.1508770315,-95.9430143767,housing,17,
gilcrease_museum,Gilcrease Museum,,marker,"Gilcrease Museum is one of the country's best facilities for the preservation and study of American art and history. The museum's charm, beauty and collections draw thousands of visitors from around the world to the hills just northwest of downtown Tulsa. Gilcrease Museum houses the world's largest, most comprehensive collection of art and artifacts of the American West. The museum also offers an unparalleled collection of Native American art and artifacts, as well as historical manuscripts, documents and maps. Beyond the extensive Gilcrease collections and exhibits are its beautiful facilities and gardens. Themed gardens have been developed on 23 of the museum's 460 acres.","1400 North Gilcrease Museum Road, Tulsa, Oklahoma 74127-2100",,http://images-cf.localist.com/assets/main/business_huge-c0846f6f497bda77b914557561c412e0.png,TU MAIN CAMPUS,36.174487,-96.020985,housing,14,
ha_chapman_stadium,H.A. Chapman Stadium,,marker,"The H.A. and Mary K. Chapman Foundations provided the lead gift for the 2008 stadium improvements. Renovations included new stadium seating, improved and expanded restroom facilities, updated concession areas and dedicated handicap-accessible seating at every price point in the stadium. A state-of-the-art scoreboard has been erected behind the south end zone to allow fans to view a high-resolution display of live and recorded video, scores, animation and more.","3112 East 8th Street, Tulsa, Oklahoma 74104-9700",,http://images-cf.localist.com/assets/main/business_huge-c0846f6f497bda77b914557561c412e0.png,ATHLETIC FACILITIES,36.1488084894,-95.9437607877,athletics,16,
hardesty_hall,Hardesty Hall,,marker,"Hardesty Hall, a 100,000-square-foot residence hall, opened in August 2015. It housing around 300 students as well as 36,000 square feet of office space for the Holmes Student Center and other services. Located near the middle of campus, Hardesty sits between the Student Union and McFarlin Library.","3105 East 5th Place, Tulsa, Oklahoma 74104-9700",,http://images-cf.localist.com/photos/329688/huge/11e39f03134057559e89d7c7e6f2775c6594b610.jpg,STUDENT HOUSING,36.152988,-95.944588,housing,17,
hardesty_sports_complex_588,Hardesty Sports Complex,,marker,Several new buildings located west of Delaware Avenue constitute the Donna J. Hardesty Sports Complex. The Hardesty complex includes the Hurricane Soccer/Track Facility and a new softball park.,"South Delaware Avenue, Tulsa, Oklahoma 74104-9700",,http://images-cf.localist.com/assets/main/business_huge-c0846f6f497bda77b914557561c412e0.png,ATHLETIC FACILITIES,36.152168,-95.949722,athletics,18,
harwell_field,Harwell Field,,marker,"Tulsa oilman Earl Palmer (E.P.) Harwell purchased land during the 1920s and gave it to the university. Dubbed Harwell Field, the grassy field nestled between Fraternity and Sorority Rows and behind the Lorton Performance Center is the site for outdoor movies, pick up football games and the Harwell Tennis Courts.","South Gary Place, Tulsa, Oklahoma 74104-9700",,http://images-cf.localist.com/assets/main/business_huge-c0846f6f497bda77b914557561c412e0.png,ATHLETIC FACILITIES,36.1517026416,-95.9431672146,parking,18,
harwell_hall,Harwell Hall,,marker,"Harwell Gymnasium was completed in 1920 after Tulsa oilman E.P. Harwell donated $100,000 for its construction. It was renovated in 1966-67 and renamed Harwell Alumni Library. Currently, it houses the Department of Anthropology.","615 South Florence Avenue, Tulsa, Oklahoma 74104-9700",,http://images-cf.localist.com/photos/334635/huge/47290d46382c41514309f8c14e700268b1777219.jpg,ATHLETIC FACILITIES,36.151489,-95.944786,parking,17,
helmerich_center_for_american_research,Helmerich Center for American Research,,marker,"The Helmerich Center for American Research, located adjacent to Gilcrease Museum, houses the Gilcrease Library and Archive containing nearly 100,000 rare books, documents, maps and unpublished works. The collection includes a vast archive of printed documents, dating back to the time of Columbus, that detail Spanish arrival in the New World, as well as documents that tell the stories of the New England colonies, westward expansion and the experiences of America's native peoples. The center enhances scholarship opportunities relating to Gilcrease Museum and its collection.","1400 North Gilcrease Museum Road, Tulsa, Oklahoma 74127-2100",,http://images-cf.localist.com/assets/main/business_huge-c0846f6f497bda77b914557561c412e0.png,TU MAIN CAMPUS,36.1732,-96.021285,parking,18,
helmerich_hall,Helmerich Hall,,marker,"Helmerich Hall is the home of the Collins College of Business. Renovations were completed in 2008. A front arch offers a grand entrance to welcome students and visitors and beautifully connects Helmerich Hall with the campus. A tower entrance was added on the north side the building, which has Gothic architectural elements that blend with the rest of campus. The college also renovated its interior spaces, adding comfortable public spaces for students to meet and study.","The University of Tulsa, 3102-3128 East 5th Street, Tulsa, OK 74104, USA",,http://images-cf.localist.com/assets/main/business_huge-c0846f6f497bda77b914557561c412e0.png,TU MAIN CAMPUS,36.153233,-95.947166,mainCampus,17,
henneke_building,Henneke Building,,marker,"Located just off of the main campus, the Henneke building is now used for small speaking engagements. It also houses important university archives, such as the Alumni Heritage collection, Continuing Engineering and Science Education offices and the Institute for Information Security.","1204 South Harvard Avenue, Tulsa, Oklahoma 74104-9700",,http://images-cf.localist.com/assets/main/business_huge-c0846f6f497bda77b914557561c412e0.png,TU MAIN CAMPUS,36.145798,-95.940697,mainCampus,18,
hillel_house,Hillel House,,marker,A number of campus ministries maintain campus facilities and programs of outreach and nurture for their respective constituencies. Each of these ministries adds its distinctive identity and voice to the interfaith conversation that articulates the religious life of the university.,"315 South Delaware Avenue, Tulsa, Oklahoma 74104-9700",,http://images-cf.localist.com/assets/main/business_huge-c0846f6f497bda77b914557561c412e0.png,CAMPUS MINISTRIES,36.1557788343,-95.9483992245,religious,18,
hurricane_athletic_building,Hurricane Athletic Building,,marker,The athletic training room in the Hurricane Athletic Building is used primarily as a lab for the practicum courses in the athletic training program as well as an exercise physiology lab. This facility also houses Campus Security offices.,"3115 East 8th Street, Tulsa, Oklahoma 74104-9700",,http://images-cf.localist.com/assets/main/business_huge-c0846f6f497bda77b914557561c412e0.png,ATHLETIC FACILITIES,36.150089,-95.943741,athletics,18,
jackson_commons,Jackson Commons,,marker,This green space in front of the Roxana R�zsa and Robert Lorton Performance Center often hosts outdoor film screenings and special events.,"550 South Gary Place, Tulsa, Oklahoma 74104-9700",,http://images-cf.localist.com/assets/main/business_huge-c0846f6f497bda77b914557561c412e0.png,TU MAIN CAMPUS,36.1517113423,-95.9406657116,mainCampus,18,
john_mabee_hall,John Mabee Hall,,marker,"John Mabee Hall is TU's traditional all-male residence. Renovations were completed in 2014. In addition to the many features it shares with other TU residence halls, it offers a relaxed club atmosphere with a comfortable main lounge featuring a snooker table, fireplace and 65-inch HDTV.","2807 East 5th Place, Tulsa, Oklahoma 74104-9700",,http://images-cf.localist.com/assets/main/business_huge-c0846f6f497bda77b914557561c412e0.png,STUDENT HOUSING,36.1532057446,-95.9487801779,housing,17,
kendall_hall,Kendall Hall,,marker,"Kendall Hall features two fully equipped theaters, a scene shop, costume shop and computer design lab. Chapman Theatre has a proscenium thrust stage and seats 375. It is equipped with a computerized lighting board and sound system.","601 South College Avenue, Tulsa, Oklahoma 74104-9700",,http://images-cf.localist.com/photos/281917/huge/7f347ff200c0f6b9ec28a4a12c2ae038e1d8ca8d.jpg,TU MAIN CAMPUS,36.1519231495,-95.9452061607,mainCampus,17,
keplinger_hall,Keplinger Hall,,marker,"Keplinger Hall is home to the College of Engineering and Natural Sciences. It is equipped with labs, lecture rooms, faculty offices and study areas. Renovations are set to begin in 2015.","430 South Gary Place, Tulsa, Oklahoma 74104-9700",,http://images-cf.localist.com/assets/main/business_huge-c0846f6f497bda77b914557561c412e0.png,TU MAIN CAMPUS,36.1539317426,-95.9419129276,mainCampus,17,
lafortune_house,LaFortune House,,marker,"LaFortune is the first TU residence hall to have an International Living Community. In addition to the many features it shares with other TU residence halls, LaFortune includes a vast open main lounge with fireplace and pool table. The large-screen TV is great for watching sporting events and movies. Suite-style living creates an atmosphere of community and recreational opportunities.","3202 East 7th Street, Tulsa, Oklahoma 74104-9700",,http://images-cf.localist.com/assets/main/business_huge-c0846f6f497bda77b914557561c412e0.png,STUDENT HOUSING,36.1504831813,-95.9421277411,housing,17,
