id,name,search_keys.0,type,description,address,website,photos.0,category,marker.lat,marker.lng,marker.icon,gmaps.min_zoom,gmaps.max_zoom
little_blue_house_833,Little Blue House,,marker,"The Little Blue House is home to the United Campus Ministries. UCM is comprised of University of Tulsa students of all faiths and backgrounds � including those who are not sure if they have a faith. UCM is a �ministry of inclusion,� meaning that we believe everyone is a child of God and that all are welcome � regardless of faith tradition, race, gender, sexual orientation, national origin, age, ability or background.","2839 East 5th Street, Tulsa, Oklahoma 74104-9700",,http://images-cf.localist.com/photos/316041/huge/28371adc5afbcf1b92f45b55052d2380ed815351.jpg,TU MAIN CAMPUS,36.1538648228,-95.9475703644,mainCampus,18,
lorton_hall,Lorton Hall,,marker,"The Department of Psychology is located in the recently renovated Lorton Hall, which contains offices, classrooms, research labs, study areas, and clinical training space.","2820 East 6th Street, Tulsa, Oklahoma 74104-9700",,http://images-cf.localist.com/assets/main/business_huge-c0846f6f497bda77b914557561c412e0.png,TU MAIN CAMPUS,36.1513516684,-95.9479511485,mainCampus,17,
lorton_performance_center,Lorton Performance Center,,marker,"The Roxana Rozsa and Robert Eugene Lorton Performance Center was completed in 2011. The facility includes the Herbert and Roseline Gussman Concert Hall with seating for 635 on two floors, as well as a full performance stage with ballet floor, scenery fly and trap room, a hydraulic orchestra pit, theatrical lighting and acoustical control booths. Guests enter through Ann and Jack Graves Grand Hall, an elegant and spacious lobby that serves as an art gallery and pre-function space for receptions and similar gatherings.\n\nLorton Performance Center web site","550 South Gary Place, Tulsa, Oklahoma 74104-9700",,http://images-cf.localist.com/photos/302794/huge/86dcc146b12bc5614361d50648da231e18a2baac.jpg,TU MAIN CAMPUS,36.1516955188,-95.9416484921,mainCampus,16,
lorton_village_apartments,Lorton Village Apartments,,marker,"The active Lorton Village community is conveniently located on the south central side of campus and looks out on Chapman Commons to the west and H.A. Chapman Stadium to the east. With easy access to 11th Street and lots of excitement on game days, living in this community is never boring. Lorton Village consists of 48 two-bedroom apartments and 18 one-bedroom apartments. Primarily an undergrad living community, Lorton Village boasts two sand volleyball pits.","2820 East 8th Street, Tulsa, Oklahoma 74104-9700",,http://images-cf.localist.com/assets/main/business_huge-c0846f6f497bda77b914557561c412e0.png,STUDENT HOUSING,36.1487875466,-95.9458689067,housing,17,
lottie_jane_mabee_hall,Lottie Jane Mabee Hall,,marker,"Lottie Jane is TU's traditional women's residence hall. It offers a warm, home-like atmosphere with a parlor that features a fireplace, grand piano and elegant furnishings. Lottie Jane is known for its active hall government, which plans social and academic programs throughout the year. A remodel will be complete in fall 2015.","2808 East 6th Street, Tulsa, Oklahoma 74104-9700",,http://images-cf.localist.com/photos/329690/huge/1f1ea7d6abb99799b9d716d8cde11d71298e8712.jpg,STUDENT HOUSING,36.151252813,-95.9486972834,housing,17,
mabee_gym,Mabee Gym,,marker,"The Mabee Gym is home to the TU Athletic Department as well as athletic training and practice facilities for TU intercollegiate sports. It also provides racquetball and squash facilities for use by students, faculty and staff.","3105 East 8th Street, Tulsa, Oklahoma 74104-9700",,http://images-cf.localist.com/assets/main/business_huge-c0846f6f497bda77b914557561c412e0.png,ATHLETIC FACILITIES,36.1500326633,-95.9442598049,athletics,17,
mabee_legal_information_center,Mabee Legal Information Center,,marker,"The MLIC offers the latest library technologies in a comfortable, spacious and attractive research environment for law students, faculty and attorneys. The center also provides space for both law school journal offices, the Board of Advocates, the Utsey Family Native American Law Center, Comparative and International Law room, an Alternative Dispute Resolution Center, an Alumni Conference room and many group study rooms.","407 South Florence Avenue, Tulsa, Oklahoma 74104-9700",,http://images-cf.localist.com/assets/main/business_huge-c0846f6f497bda77b914557561c412e0.png,TU MAIN CAMPUS,36.1540446398,-95.9443612331,mainCampus,18,
mary_k_chapman_center,Mary K. Chapman Center,,marker,The Mary K. Chapman Center for Communicative Disorders provides professional audiology and speech-language pathology services to individuals of all ages. The center is located in a well-equipped building that is accessible to all persons with disabilities.,"2820 East 5th Street, Tulsa, Oklahoma 74104-9700",,http://images-cf.localist.com/assets/main/business_huge-c0846f6f497bda77b914557561c412e0.png,TU MAIN CAMPUS,36.153439,-95.948296,mainCampus,18,
mayo_village_apartments_student_activities_center,Mayo Village Apartments & Student Activities Center,,marker,"This active community on the southwest corner of campus looks out on Chapman Commons to the east and the Tulsa skyline to the west. This community consists of 120 two-bedroom apartments and 90 one-bedroom apartments. Mayo Village surrounds a beautiful Student Activity Center with five flat-panel televisions, Wii and Playstation gaming systems, a conference room, a huge kitchen and 16' screen for movie nights.","South Delaware Avenue, Tulsa, Oklahoma 74104-9700",,http://images-cf.localist.com/assets/main/business_huge-c0846f6f497bda77b914557561c412e0.png,STUDENT HOUSING,36.1486971707,-95.9480471779,housing,17,
mcclure_hall,McClure Hall,,marker,"Dedicated in the spring of 1959 as part of the inaugural week celebration of Dr. Ben Henneke, McClure Hall once housed the president's office, but now offices of the controller, registrar and research can be found there.","2905 East 7th Street, Tulsa, Oklahoma 74104-9700",,http://images-cf.localist.com/assets/main/business_huge-c0846f6f497bda77b914557561c412e0.png,TU MAIN CAMPUS,36.1510880528,-95.9473714577,mainCampus,18,
mcfarlin_library,McFarlin Library,,marker,"McFarlin Library is the academic heart of the university. Here you will find the Pauline M. Walter Academic Technology Center, library's reading rooms, Gray Student Commons, Ann and Jack Graves Faculty Study, the Cort and Martha Dietler Cafe and the Jack and Tybie Davis Satin Rare Book Room.","2933  East 6th Street, Tulsa, Oklahoma 74104-9700",,http://images-cf.localist.com/photos/340165/huge/890be479af119d2a78ef5d72cbb983f6d9211145.jpg,TU MAIN CAMPUS,36.1522698452,-95.9459790086,mainCampus,16,
muslim_student_association_prayer_house,Muslim Student Association Prayer House,,marker,"The Muslim Student Association facility has room for 100 people in the first-floor men's prayer hall and 50 in the second-floor balcony, serving as the women's prayer hall.","3020 East 4th Place, Tulsa, Oklahoma 74104-9700",,http://images-cf.localist.com/assets/main/business_huge-c0846f6f497bda77b914557561c412e0.png,CAMPUS MINISTRIES,36.1544980175,-95.9452013264,mainCampus,18,
newman_center,Newman Center,,marker,The Newman Center supports the university's Catholic community.,"440 South Florence, Tulsa, Oklahoma 74104-9700",,http://images-cf.localist.com/photos/312168/huge/f64484705bc738e23b04294e54bf2f1724081d78.jpg,CAMPUS MINISTRIES,36.1542166397,-95.9452650552,religious,18,
norman_village_apartments_clubhouse,Norman Village Apartments & Clubhouse,,marker,"Nestled on the northwest corner of campus, Norman Village is home to undergraduate, graduate and law students seeking a quieter environment. This community consists of 106 two-bedroom and 44 one-bedroom apartments; a clubhouse with HD flat-panel television and surround sound, Wii gaming system, and a conference room with a convertible billiards table; and a pool.","315 South Delaware Avenue, Tulsa, Oklahoma 74104-9700",,http://images-cf.localist.com/assets/main/business_huge-c0846f6f497bda77b914557561c412e0.png,STUDENT HOUSING,36.1559740718,-95.9487207202,housing,17,
north_campus_615,North Campus,,marker,"The goal of North Campus is to explore innovations for the petroleum industry and foster learning by students, researchers, private industry and governments. The land and buildings were donated to the university by the Humble Oil and Refining Company in 1965.","2450 East Marshall Street, Tulsa, Oklahoma 74110-4726",,http://images-cf.localist.com/assets/main/business_huge-c0846f6f497bda77b914557561c412e0.png,TU MAIN CAMPUS,36.171436,-95.955254,mainCampus,18,
oliphant_hall,Oliphant Hall,,marker,"Home to the Department of Languages, as well as the Department of Biological Science, Oliphant Hall includes a language lab, science classrooms, an auditorium, a rooftop greenhouse and a small inner courtyard garden.","3015 East 7th Street, Tulsa, Oklahoma 74104-9700",,http://images-cf.localist.com/assets/main/business_huge-c0846f6f497bda77b914557561c412e0.png,TU MAIN CAMPUS,36.151062,-95.945419,mainCampus,17,
college_of_health_sciences_851,Oxley Health Sciences Facilities,,marker,,"1215 S. Boulder Ave., Tulsa, OK, 74119",,http://images-cf.localist.com/assets/main/business_huge-c0846f6f497bda77b914557561c412e0.png,TU MAIN CAMPUS,36.144484,-95.987854,mainCampus,18,
phillips_hall_166,Phillips Hall,,marker,"Phillips Hall houses the School of Art and the Alexandre Hogue Gallery. Classrooms and studio space provide students with a diverse variety of learning opportunities. Phillips Hall, which originally housed the program of petroleum engineering, is one of the oldest buildings on campus.","2930 East 5th Street, Tulsa, Oklahoma 74104-9700",,http://images-cf.localist.com/assets/main/business_huge-c0846f6f497bda77b914557561c412e0.png,TU MAIN CAMPUS,36.1529010112,-95.9464950466,mainCampus,17,
rayzor_hall,Rayzor Hall,,marker,"J. Newton Rayzor Hall houses the Tandy School of Computer Science and Department of Electrical and Computer Engineering. Located east of the Student Union, Rayzor Hall includes 24 integrated classrooms and teaching/research laboratories, 33 faculty and graduate student offices, two conference rooms, and five student commons areas with a student organizations office.","East 5th Place, Tulsa, Oklahoma 74104-9700",,http://images-cf.localist.com/assets/main/business_huge-c0846f6f497bda77b914557561c412e0.png,TU MAIN CAMPUS,36.1531041826,-95.9427271399,mainCampus,17,
reynolds_centerathletic_training_facility,Reynolds Center,,marker,"The Donald W. Reynolds Center is home to the TU basketball and volleyball teams. It is also used for other university and community events including graduation, dinners and concerts. Features include a variety of modalities and rehabilitation equipment, such as a Biodex. Athletic training students utilize this facility for completing their clinical rotations. There also is a sports medicine conference room for athletic training classes.","3208 E. 8th St., Tulsa, Oklahoma 74104-9700",,http://images-cf.localist.com/assets/main/business_huge-c0846f6f497bda77b914557561c412e0.png,ATHLETIC FACILITIES,36.1488901881,-95.9421424663,athletics,16,
samson_plaza,Samson Plaza,,marker,"This 1.5-acre plaza connects Keplinger, Rayzor and Stephenson halls. Funded through a gift from Samson, the plaza honors the memory of the late Charles Schusterman. The outdoor space welcomes students and visitors with the following amenities: fountain with black granite base, vintage acorn lamps, oak and crape myrtle trees and seasonal flower beds.","East 5th Place, Tulsa, Oklahoma 74104-9700",,http://images-cf.localist.com/assets/main/business_huge-c0846f6f497bda77b914557561c412e0.png,TU MAIN CAMPUS,36.1535414915,-95.9428295939,athletics,18,
sharp_chapel,Sharp Chapel,,marker,"In 1959, TU dedicated Sharp Memorial Chapel, an expression of the devotion of Mr. And Mrs. Robert C. Sharp and the dreams of Dr. Clarence I. Pontius. Within the building are: the Sanctuary, Josephine Meditation Chapel, office of the Sharp Chaplain, Robert C. Sharp Westminster Student Center, Josephine P. Sharp Reception Suite, Buford Atrium and Martha S. Canterbury Suite.","2940 East 6th Street, Tulsa, Oklahoma 74104-9700",,http://images-cf.localist.com/photos/310688/huge/46a11337228b022667a7eb81e036d1ff2cf25268.jpg,CAMPUS MINISTRIES,36.1514417058,-95.9462614957,religious,18,
sharp_plaza,Sharp Plaza,,marker,"Located between McFarlin Library and Sharp Chapel in the heart of campus, Sharp Plaza often is a hub of activity between classes.","2940 East 6ht Street, Tulsa, Oklahoma 74104-9700",,http://images-cf.localist.com/assets/main/business_huge-c0846f6f497bda77b914557561c412e0.png,TU MAIN CAMPUS,36.1518520108,-95.946129,photoOp,18,
soccer_practice_field_10,Soccer Practice Field,,marker,,"759 S Delaware Ave, Tulsa, OK 74104, USA",,http://images-cf.localist.com/assets/main/business_huge-c0846f6f497bda77b914557561c412e0.png,ATHLETIC FACILITIES,36.1492596783,-95.9500470417,athletics,18,
sorority_row,Sorority Row,,marker,"Nine national sororities have chapters on campus. These organizations encourage scholarship, leadership, social and personal development.","East 5th Place, Tulsa, Oklahoma 74104-9700",,http://images-cf.localist.com/assets/main/business_huge-c0846f6f497bda77b914557561c412e0.png,STUDENT HOUSING,36.1526261602,-95.9431748135,housing,17,
stephenson_hall,Stephenson Hall,,marker,"Stephenson Hall houses the McDougall School of Petroleum Engineering and Department of Mechanical Engineering. Located on the corner of Gary and 5th Places, it features 16 integrated classrooms and teaching/research laboratories, 34 faculty and graduate student offices, four student commons areas, a conference room and a student organizations office.","3205 East 5th Place, Tulsa, Oklahoma 74104-9700",,http://images-cf.localist.com/assets/main/business_huge-c0846f6f497bda77b914557561c412e0.png,TU MAIN CAMPUS,36.1530833483,-95.9420742712,mainCampus,17,
student_union,Student Union,Allen Chapman Activity Center,marker,"Allen Chapman Student Union is a 78,000-square-foot, two-story building with a center atrium that is home to nine food venues. The Union is one of the primary sites that accommodates the event-related needs of the university and, on a more limited basis, those of community friends. Renovations completed in 2014 feature a food court and redesigned entrances. Lecture rooms received facelifts and outdoor patio space around the building was completed in 2015.","3135 East 5th Place, Tulsa, OK  74104",,http://images-cf.localist.com/assets/main/business_huge-c0846f6f497bda77b914557561c412e0.png,TU MAIN CAMPUS,36.1534155312,-95.943567373,athletics,16,
true_blue_house_590,True Blue House,,marker,,"3126 E 5th Pl Tulsa, OK 74104",,http://images-cf.localist.com/photos/348985/huge/2d2d61e95b85b218c0c198f2fb656f04b3793321.jpg,TU MAIN CAMPUS,36.1524665468,-95.9438257669,athletics,18,
tyrrell_hall,Tyrrell Hall,,marker,"Tyrrell Hall is home to six state-of-the-art multimedia classrooms. Envisioned as a teaching laboratory, Tyrrell offers a place where faculty can experiment with technology and explore how it might enhance and extend classroom interactions both near and far. Two classrooms accommodate small seminars of 10-15 students; two classrooms are suited to classes with 18-20 students; one classroom accommodates 30 students; and the Ellen G. Adelson Auditorium will seat 108.","2930 East 6th Street, Tulsa, Oklahoma 74104-9700",,http://images-cf.localist.com/assets/main/business_huge-c0846f6f497bda77b914557561c412e0.png,TU MAIN CAMPUS,36.151527,-95.946854,athletics,18,
united_campus_ministry,United Campus Ministry,,marker,"UCM is comprised of TU students of all faiths and backgrounds, including those who are not sure if they have a faith. UCM welcomes everyone regardless of faith tradition, race, gender, sexual orientation, national origin, age or ability.","2839 East 5th Street, Tulsa, Oklahoma 74104-9700",,http://images-cf.localist.com/assets/main/business_huge-c0846f6f497bda77b914557561c412e0.png,CAMPUS MINISTRIES,36.1539275029,-95.946340411,religious,18,
university_school,University School,,marker,"University School is a private school, serving academically talented children ages 3 through 13 (eighth grade). USchool serves as a national model of excellence in pre-college education for students of high academic potential by working with them to enhance academic achievement, develop personal and community responsibility and foster creativity.","326 South College Avenue, Tulsa, Oklahoma 74104-9700",,http://images-cf.localist.com/photos/396921/huge/01effee0f8cb7f68a29008a777520a63a4b851d2.jpg,TU MAIN CAMPUS,36.1552416866,-95.9466908479,photoOp,18,
university_square_apartments,University Square Apartments,,marker,"Living on campus cannot be more comfortable or convenient than living in University Square Apartments _ South and West, near door to the Collins Fitness Center and the Hurricane Track and Field/Soccer Complex. This community consists of 48 three-bedroom, 120 two-bedroom and 48 one-bedroom apartments. A primarily undergraduate community, USA-West has a pool and courtyard area that are accessible to USA-South residents.","South Delaware Avenue, Tulsa, Oklahoma 74104-9700",,http://images-cf.localist.com/assets/main/business_huge-c0846f6f497bda77b914557561c412e0.png,STUDENT HOUSING,36.1541693256,-95.9482567447,housing,17,
university_united_methodist_church_197,University United Methodist Church,,marker,,"500 South College Tulsa, OK 74104",,http://images-cf.localist.com/photos/311882/huge/32ca521f06f3c68a5c6fb6a23958bf0e5f79404d.jpg,CAMPUS MINISTRIES,36.1540767206,-95.9465015043,photoOp,18,
wesley_foundation,Wesley Foundation,,marker,The university is supported by a number of campus ministries that maintain facilities and outreach programs.,"3019 East 5th Street, Tulsa, Oklahoma 74104-9700",,http://images-cf.localist.com/assets/main/business_huge-c0846f6f497bda77b914557561c412e0.png,CAMPUS MINISTRIES,36.1538481829,-95.945081411,religious,18,
west_park_village,West Park Village,,marker,"Located a few blocks from campus, the West Park apartments offer students a pet-friendly option for college life. This undergraduate and graduate student community has 15 two-bedroom and five one-bedroom apartments. The building has well-lit, monitored interior corridors, electronic-access entrances and other safety features.","2405 East 4th Place, Tulsa, Oklahoma 74104-9700",,http://images-cf.localist.com/assets/main/business_huge-c0846f6f497bda77b914557561c412e0.png,STUDENT HOUSING,36.1536586361,-95.9573008922,housing,18,
westby_hall,Westby Hall,,marker,The offices of Institutional Advancement and the Golden Hurricane Club are housed in Westby.,"710 South College Avenue, Tulsa, Oklahoma 74104-9700",,http://images-cf.localist.com/assets/main/business_huge-c0846f6f497bda77b914557561c412e0.png,TU MAIN CAMPUS,36.150475,-95.9466377669,religious,18,
zarrow_center_for_art_education,Zarrow Center for Art & Education,,marker,"In the midst of the revitalized downtown Brady Arts District is the Henry Zarrow Center for Art & Education, which serves TU's School of Art and Gilcrease Museum. The Zarrow Center includes classrooms, art studios, gallery space and a reception area for events.","124 East M.B. Brady Street, Tulsa, Oklahoma 74103-2014",,http://images-cf.localist.com/photos/340090/huge/483786c5665e3840e8f35736711991494a1dc93f.jpg,TU MAIN CAMPUS,36.158813,-95.991516,religious,18,
zink_hall,Zink Hall,,marker,"This building is home to several departments including English, Continuing Education and Information Technology.","3101 East 7th Street, Tulsa, Oklahoma 74104-9700",,http://images-cf.localist.com/assets/main/business_huge-c0846f6f497bda77b914557561c412e0.png,TU MAIN CAMPUS,36.1510314921,-95.9446142245,religious,17,
